{
  "$schema": "https://json-schema.org/draft/2020-12/schema",
  "$id": "https://github.com/sljzdotcom/AI-Token-Meter/contracts/schemas/usage-snapshot.schema.json",
  "title": "AI Token Meter Usage Snapshot",
  "description": "Versioned, secret-free provider usage data exchanged by platform implementations.",
  "type": "object",
  "required": [
    "schemaVersion",
    "providerId",
    "displayName",
    "status",
    "fetchedAt",
    "staleAfterSeconds"
  ],
  "properties": {
    "schemaVersion": {
      "const": 1
    },
    "providerId": {
      "enum": ["claude", "codex", "deepseek", "gemini", "code0"]
    },
    "displayName": {
      "enum": ["Claude Code", "OpenAI Codex", "DeepSeek", "Google Antigravity", "Code0"]
    },
    "status": {
      "enum": [
        "fresh",
        "cached",
        "refreshing",
        "notInstalled",
        "authenticationRequired",
        "setupRequired",
        "unavailable",
        "unrecognizedOutput"
      ]
    },
    "usedRatio": {
      "type": ["number", "null"],
      "minimum": 0,
      "maximum": 1
    },
    "primaryMetric": {
      "$ref": "#/$defs/metric"
    },
    "secondaryMetric": {
      "$ref": "#/$defs/metric"
    },
    "fetchedAt": {
      "type": "string",
      "format": "date-time"
    },
    "staleAfterSeconds": {
      "type": "integer",
      "minimum": 1
    },
    "sourceVersion": {
      "type": ["string", "null"],
      "maxLength": 64
    },
    "statusMessage": {
      "type": ["string", "null"],
      "maxLength": 240
    },
    "geminiQuotaMetrics": {
      "type": "array",
      "maxItems": 2,
      "items": { "$ref": "#/$defs/geminiQuotaMetric" }
    },
    "antigravitySharedQuotaMetrics": {
      "type": "array",
      "maxItems": 2,
      "items": { "$ref": "#/$defs/antigravitySharedQuotaMetric" }
    },
    "antigravityCLIInfo": {
      "$ref": "#/$defs/antigravityCLIInfo"
    },
    "resetCredits": {
      "type": "array",
      "items": {
        "$ref": "#/$defs/resetCredit"
      }
    },
    "localActivity": {
      "$ref": "#/$defs/localActivity"
    },
    "dailyHistory": {
      "type": "array",
      "maxItems": 31,
      "items": {
        "$ref": "#/$defs/dailyHistoryEntry"
      }
    },
    "historyFetchedAt": {
      "type": ["string", "null"],
      "format": "date-time"
    }
  },
  "additionalProperties": true,
  "$defs": {
    "geminiQuotaMetric": {
      "type": "object",
      "required": ["label", "current", "limit", "unit", "kind"],
      "allOf": [
        {
          "$ref": "#/$defs/metric"
        }
      ],
      "properties": {
        "label": {
          "enum": [
            "Gemini · Five hour",
            "Gemini · Weekly"
          ]
        },
        "current": {
          "type": "number",
          "minimum": 0,
          "maximum": 100
        },
        "limit": {
          "const": 100
        },
        "unit": {
          "const": "percent"
        },
        "kind": {
          "const": "officialLimit"
        },
        "resetAt": {
          "type": "string",
          "format": "date-time"
        }
      }
    },
    "antigravitySharedQuotaMetric": {
      "type": "object",
      "required": ["label", "current", "limit", "unit", "kind", "resetAt"],
      "allOf": [
        {
          "$ref": "#/$defs/metric"
        }
      ],
      "properties": {
        "label": {
          "enum": [
            "Claude/GPT · Five hour",
            "Claude/GPT · Weekly"
          ]
        },
        "current": {
          "type": "number",
          "minimum": 0,
          "maximum": 100
        },
        "limit": {
          "const": 100
        },
        "unit": {
          "const": "percent"
        },
        "kind": {
          "const": "officialLimit"
        },
        "resetAt": {
          "type": "string",
          "format": "date-time"
        }
      }
    },
    "antigravityCLIInfo": {
      "type": ["object", "null"],
      "properties": {
        "currentModel": {
          "type": ["string", "null"],
          "maxLength": 120,
          "pattern": "^Gemini [0-9]+(?:\\.[0-9]+)+(?: [A-Za-z0-9][A-Za-z0-9.-]*| \\((?:High|Medium|Low)\\)){1,8}$"
        },
        "availableModelCount": {
          "type": ["integer", "null"],
          "minimum": 1,
          "maximum": 64
        },
        "modelFamilies": {
          "type": "array",
          "maxItems": 16,
          "uniqueItems": true,
          "items": {
            "type": "string",
            "maxLength": 120,
            "pattern": "^Gemini [0-9]+(?:\\.[0-9]+)+(?: [A-Za-z0-9][A-Za-z0-9.-]*| \\((?:High|Medium|Low)\\)){1,8}$"
          }
        }
      },
      "required": ["modelFamilies"],
      "additionalProperties": false
    },
    "metric": {
      "type": ["object", "null"],
      "required": ["label", "current", "unit", "kind"],
      "properties": {
        "label": { "type": "string", "maxLength": 120 },
        "current": { "type": "number" },
        "limit": { "type": ["number", "null"] },
        "unit": { "enum": ["percent", "cny", "usd", "tokens", "requests", "siteCredits"] },
        "kind": { "enum": ["officialLimit", "balance", "localBudget", "cumulativeUsage"] },
        "resetAt": { "type": ["string", "null"], "format": "date-time" },
        "resetDescription": { "type": ["string", "null"], "maxLength": 160 }
      },
      "additionalProperties": true
    },
    "resetCredit": {
      "type": "object",
      "required": ["kind", "count", "expiresAt"],
      "properties": {
        "kind": { "enum": ["fullUsageReset"] },
        "count": { "type": "integer", "minimum": 0 },
        "expiresAt": { "type": "string", "format": "date-time" }
      },
      "additionalProperties": false
    },
    "localActivity": {
      "type": ["object", "null"],
      "properties": {
        "periodDays": { "const": 30 },
        "sessions": { "type": "integer", "minimum": 0 },
        "tokens": { "type": "integer", "minimum": 0 },
        "activeDays": { "type": "integer", "minimum": 0, "maximum": 30 },
        "longestSessionSeconds": { "type": "integer", "minimum": 0 }
      },
      "required": ["periodDays", "sessions", "tokens", "activeDays"],
      "additionalProperties": false
    },
    "dailyHistoryEntry": {
      "type": "object",
      "required": ["date", "costCny", "requests", "tokens"],
      "properties": {
        "date": { "type": "string", "format": "date" },
        "costCny": { "type": "number", "minimum": 0 },
        "requests": { "type": "integer", "minimum": 0 },
        "tokens": { "type": "integer", "minimum": 0 }
      },
      "additionalProperties": false
    }
  }
}
