{
  "schemaVersion": 1,
  "providerId": "gemini",
  "displayName": "Google Antigravity",
  "status": "unavailable",
  "usedRatio": null,
  "primaryMetric": null,
  "secondaryMetric": null,
  "fetchedAt": "2026-09-03T00:00:00Z",
  "staleAfterSeconds": 300,
  "sourceVersion": "fixture",
  "statusMessage": "Antigravity CLI quota is currently unavailable. Installation and sign-in status have not been checked."
}
